{
  "schema": "ams-update/1",
  "channel": "stable",
  "generated_at": "2026-10-19T21:00:00+08:00",
  "sequence": 1,
  "components": [
    {
      "id": "plugin.ams.music.trainer",
      "kind": "plugin",
      "version": "0.1.0",
      "url": "https://github.com/yan-mc/ams-release/releases/download/v0.1.0/trainer-0.1.0.tgz",
      "size": 12345,
      "sha256": "0000000000000000000000000000000000000000000000000000000000000000",
      "requires": {
        "kernel": ">=0.2.1-rc.2 <0.3.0"
      },
      "notes": "示例清单，正式发布前替换"
    }
  ],
  "signature": "ed25519:Xyk0UKC+qPq5RNxlKVEkqcvhHe/CQ+gUE1z62JWbjH+WSl3XX6nR0QxBXwrTK6wKwbB8sKdBaGBYlwZ5yetFCw=="
}
